{
  "schema_version": "1.0.0",
  "snapshot_id": "public-github-activity-fixture-01",
  "captured_at": "2026-10-09T22:09:23Z",
  "status": {
    "availability": "empty",
    "stale": false,
    "message": "No verified public GitHub activity records were available for this deterministic first snapshot."
  },
  "source": {
    "provider": "github",
    "mode": "checked_in_fixture",
    "url": "https://github.com/"
  },
  "allowed_repositories": [
    "https://github.com/cristian-cardona-dev/professional-evolution-portfolio",
    "https://github.com/cristian-cardona-dev/cloud-dashboard",
    "https://github.com/cristian-cardona-dev/ai-chat-app",
    "https://github.com/cristian-cardona-dev/ai-automation-workflow-lab"
  ],
  "repositories": []
}
